{"schema":"pliego.document-semantics.canonical","version":1,"profile":{"schema":"pliego.profile.pdfua-1","version":1},"policy":{"logical_content":"required","navigation":"required","paint_coverage":"complete"},"scene":{"schema":"pliego.document-scene","version":2},"source":{"root":"pliego-input:///","entrypoint":"document.html","tree_order":"composed-dom-preorder-v1"},"metadata":{"title":"Invoice","language":null},"language":"en-US","root":0,"nodes":[{"id":0,"role":"document","source":{"kind":"dom","preorder":0},"language":null,"name":null,"alternate_text":null,"replacement_text":null,"semantics":{"kind":"none"},"children":[{"kind":"node","id":1},{"kind":"node","id":3},{"kind":"node","id":10},{"kind":"node","id":18},{"kind":"node","id":20},{"kind":"node","id":21}]},{"id":1,"role":"heading","source":{"kind":"dom","preorder":1},"language":null,"name":"Invoice","alternate_text":null,"replacement_text":null,"semantics":{"kind":"heading","level":1},"children":[{"kind":"node","id":2}]},{"id":2,"role":"span","source":{"kind":"dom","preorder":2},"language":null,"name":null,"alternate_text":null,"replacement_text":"Invoice","semantics":{"kind":"none"},"children":[{"kind":"fragment","id":0}]},{"id":3,"role":"list","source":{"kind":"dom","preorder":3},"language":null,"name":null,"alternate_text":null,"replacement_text":null,"semantics":{"kind":"list","ordered":true,"numbering":"decimal","start":1},"children":[{"kind":"node","id":4},{"kind":"node","id":7}]},{"id":4,"role":"list-item","source":{"kind":"dom","preorder":4},"language":null,"name":null,"alternate_text":null,"replacement_text":null,"semantics":{"kind":"list-item","ordinal":1},"children":[{"kind":"node","id":5},{"kind":"node","id":6}]},{"id":5,"role":"list-label","source":{"kind":"dom","preorder":5},"language":null,"name":null,"alternate_text":null,"replacement_text":null,"semantics":{"kind":"none"},"children":[]},{"id":6,"role":"list-body","source":{"kind":"dom","preorder":6},"language":null,"name":null,"alternate_text":null,"replacement_text":null,"semantics":{"kind":"none"},"children":[]},{"id":7,"role":"list-item","source":{"kind":"dom","preorder":7},"language":null,"name":null,"alternate_text":null,"replacement_text":null,"semantics":{"kind":"list-item","ordinal":2},"children":[{"kind":"node","id":8},{"kind":"node","id":9}]},{"id":8,"role":"list-label","source":{"kind":"dom","preorder":8},"language":null,"name":null,"alternate_text":null,"replacement_text":null,"semantics":{"kind":"none"},"children":[]},{"id":9,"role":"list-body","source":{"kind":"dom","preorder":9},"language":null,"name":null,"alternate_text":null,"replacement_text":null,"semantics":{"kind":"none"},"children":[]},{"id":10,"role":"table","source":{"kind":"dom","preorder":10},"language":null,"name":null,"alternate_text":null,"replacement_text":null,"semantics":{"kind":"table","rows":2,"columns":2},"children":[{"kind":"node","id":11},{"kind":"node","id":14}]},{"id":11,"role":"table-head","source":{"kind":"dom","preorder":11},"language":null,"name":null,"alternate_text":null,"replacement_text":null,"semantics":{"kind":"none"},"children":[{"kind":"node","id":12}]},{"id":12,"role":"table-row","source":{"kind":"dom","preorder":12},"language":null,"name":null,"alternate_text":null,"replacement_text":null,"semantics":{"kind":"none"},"children":[{"kind":"node","id":13}]},{"id":13,"role":"table-header-cell","source":{"kind":"dom","preorder":13},"language":null,"name":null,"alternate_text":null,"replacement_text":null,"semantics":{"kind":"table-cell","row":0,"column":0,"row_span":1,"column_span":2,"scope":"column","headers":[]},"children":[]},{"id":14,"role":"table-body","source":{"kind":"dom","preorder":14},"language":null,"name":null,"alternate_text":null,"replacement_text":null,"semantics":{"kind":"none"},"children":[{"kind":"node","id":15}]},{"id":15,"role":"table-row","source":{"kind":"dom","preorder":15},"language":null,"name":null,"alternate_text":null,"replacement_text":null,"semantics":{"kind":"none"},"children":[{"kind":"node","id":16},{"kind":"node","id":17}]},{"id":16,"role":"table-cell","source":{"kind":"dom","preorder":16},"language":null,"name":null,"alternate_text":null,"replacement_text":null,"semantics":{"kind":"table-cell","row":1,"column":0,"row_span":1,"column_span":1,"scope":"none","headers":[13]},"children":[]},{"id":17,"role":"table-cell","source":{"kind":"dom","preorder":17},"language":null,"name":null,"alternate_text":null,"replacement_text":null,"semantics":{"kind":"table-cell","row":1,"column":1,"row_span":1,"column_span":1,"scope":"none","headers":[13]},"children":[]},{"id":18,"role":"figure","source":{"kind":"dom","preorder":18},"language":null,"name":null,"alternate_text":"Company mark","replacement_text":null,"semantics":{"kind":"none"},"children":[{"kind":"fragment","id":2},{"kind":"node","id":19}]},{"id":19,"role":"caption","source":{"kind":"dom","preorder":19},"language":"es-MX","name":null,"alternate_text":null,"replacement_text":null,"semantics":{"kind":"none"},"children":[]},{"id":20,"role":"link","source":{"kind":"dom","preorder":20},"language":null,"name":"Open invoice 42","alternate_text":"Open invoice 42","replacement_text":null,"semantics":{"kind":"link","target":"https://example.test/invoices/42"},"children":[{"kind":"fragment","id":3}]},{"id":21,"role":"formula","source":{"kind":"dom","preorder":21},"language":null,"name":null,"alternate_text":"E equals m c squared","replacement_text":"E = mc²","semantics":{"kind":"none"},"children":[]}],"navigation":{"kind":"outline","roots":[0,1],"items":[{"id":0,"title":"Invoice","language":null,"target_node":1,"destination":{"page":1,"x_app_units":2880,"y_app_units":4320},"children":[]},{"id":1,"title":"Company mark","language":null,"target_node":18,"destination":{"page":1,"x_app_units":2880,"y_app_units":7200},"children":[]}]},"artifact_roots":[0],"artifacts":[{"id":0,"kind":"decoration","subtype":null,"source":{"kind":"generated","owner_preorder":0,"slot":"after"},"children":[{"kind":"fragment","id":1}]}],"fragments":[{"id":0,"kind":"text","paint":{"page":1,"operation":0},"glyphs":{"start":0,"end":1},"text_utf8":{"start":0,"end":7}},{"id":1,"kind":"path","paint":{"page":1,"operation":1}},{"id":2,"kind":"image","paint":{"page":1,"operation":2}},{"id":3,"kind":"annotation","paint":{"page":1,"operation":3}}]}
